{
  "schema_version": 2,
  "exception_id": "DOC-0242",
  "target": {
    "file": "docs/architecture/effects.md"
  },
  "category": "unclassified-sample",
  "reason": "This active public page still contains executable fences without registered sample ownership.",
  "owner": "documentation-governance",
  "created_on": "2026-08-26",
  "removal_condition": "Delete this entry when every counted fence in the exact page has registered sample ownership.",
  "violation_count": 1
}
