{
  "schema_version": 2,
  "exception_id": "DOC-0185",
  "target": {
    "file": "viewcompose-shadow-android/src/main/java/com/viewcompose/shadow/android/ShadowDecorationLayer.kt"
  },
  "category": "orphan-symbol",
  "reason": "This production source file still contains public entries without capability ownership records.",
  "owner": "documentation-governance",
  "created_on": "2026-08-26",
  "removal_condition": "Delete this entry when every counted public entry in the exact source file has one capability owner.",
  "violation_count": 1
}
