{
  "schema_version": 2,
  "exception_id": "DOC-0151",
  "target": {
    "file": "viewcompose-navigation-android/src/main/java/com/viewcompose/navigation/NavHostController.kt"
  },
  "category": "orphan-symbol",
  "reason": "This production source file still contains public entries without capability ownership records.",
  "owner": "documentation-governance",
  "created_on": "2026-08-26",
  "removal_condition": "Delete this entry when every counted public entry in the exact source file has one capability owner.",
  "violation_count": 8
}
