{
  "schema_version": 2,
  "exception_id": "DOC-0190",
  "target": {
    "file": "viewcompose-ui-contract/src/main/kotlin/com/viewcompose/ui/modifier/ModifierLayoutExtensions.kt"
  },
  "category": "orphan-symbol",
  "reason": "This production source file still contains public entries without capability ownership records.",
  "owner": "documentation-governance",
  "created_on": "2026-08-26",
  "removal_condition": "Delete this entry when every counted public entry in the exact source file has one capability owner.",
  "violation_count": 22
}
