{
  "schema_version": 2,
  "exception_id": "DOC-0001",
  "target": { "file": "docs/guides/lazy-collections.md" },
  "category": "unclassified-sample",
  "reason": "One historical code fence has not yet moved to a compiled source region.",
  "owner": "documentation-governance",
  "created_on": "2026-08-25",
  "removal_condition": "Delete this entry when the exact fence is replaced by its registered compiled region.",
  "expires_on": "2026-10-01",
  "violation_count": 1
}
