{
  "schema_version": 2,
  "exception_id": "DOC-0235",
  "target": {
    "file": "docs/modules/viewcompose-animation/README.md"
  },
  "category": "taxonomy-mismatch",
  "reason": "This locale mirror has an executable-fence parity mismatch awaiting correction.",
  "owner": "documentation-governance",
  "created_on": "2026-08-26",
  "removal_condition": "Delete this entry when the exact page has matching canonical and locale executable fences.",
  "violation_count": 1
}
